Question,Answer,Chapter
For how many days were the Israelites to eat unleavened bread?, Seven days (Exodus 12:15),12
What were the Israelites to put away from their houses during the celebration of the Passover?, Leaven (Exodus 12:15),12
On what day of the Feast of Unleavened Bread should the Israelites  to put away leaven out of their houses?, first day Exodus 12:15,12
What would happen to anyone who ate leaven during the Feast of Unleavened Bread?, They would be cut off from Israel (Exodus 12:15),12
What did God say there should be in the first day of the Feast of Unleavened Bread?," A holy convocation, Exodus 12:16",12
On which two days of the Feast of Unleavened Bread was a holy convocation (sacred assembly) to be held?, The first day and the seventh day (Exodus 12:16),12
What did God say the first and seventh day of the Feast of Unleavened Bread should be?," A holy convocation, Exodus 12:16",12
"FIB with one blank: And ye shall observe the feast of unleavened bread, for this selfsame day have I brought your ___ out of the land of Egypt.","armies, Exodus 12:17",12
What did Exodus 12:18 say that the children of Israel should eat on the fourteenth day of the first month?," Unleavened bread, Exodus 12:18",12
"In the first month, the children of Israel were told to eat unleavened bread from the fourteenth day until what day?","the one and twentieth day (21st day), Exodus 12:18",12
"In Exodus 12:21, After hearing about the Passover from God, who did Moses call for?","all the elders of Israel, Exodus 12:21",12
What were the Israelites to use to strike the side posts with the blood of the lamb?," A bunch of hyssop, Exodus 12:22",12
"When the Israelites dipped hyssop in the blood, what would the blood be in?","the basin, Exodus 12:22",12
After putting the blood of the lamb on the lintel and posts of their homes what could the children of Israel not do until the morning?," go out the door of their houses, Exodus 12:22",12
The Lord would pass over the door of the Israelites. Who would He not suffer to come into their houses?,"the destroyer, Exodus 12:23",12
"Who did Moses say would asks the Israelites ""What mean ye by this service?""","their children, Exodus 12:26",12
"After Moses told the people about the Passover and before they went away, what did the people do?","bowed their head and worshipped, Exodus 12:27",12
"FIB with one blank: And the children of Israel went away, and did as the Lord had ___ Moses and Aaron, so did they.","commanded, Exodus 12:28",12
"Bonus for 15: In Exodus chapter 12 it says that at midnight the Lord smote the firstborn in the land of Egypt. For 5 points each, list the 3 first borns which were listed"," Firstborn of Pharoah, firstborn of the captive that was in the dungeon, all the firstborn of the cattle Exodus 12:29",12
"In the lists of firstborns the Lord smote, where was the captive who's firstborn was smote?","the dungeon, Exodus 12:29",12
"In Exodus 12, there was a great cry in Egypt because what was not in Egypt?","a house where there was not one dead, Exodus 12:30",12
"When Pharaoh told Moses to leave Egypt with the Israelites and to take their flocks and herds, what else did he tell Moses to do?","bless him, Exodus 12:32",12
"After the Passover, the Egyptians were urgent upon the Israelites. What did they say to them?"," We be all dead men, Exodus 12:33",12
"Bonus for 10: And the Egyptians were ___ upon the people, that they might send them out of the land in ___.","urgent, haste, Exodus 12:33",12
"When leaving Egypt, the Israelites took their dough before what happened to it?","before it was leaveneed, Exodus 12:34",12
"When told to leave Egypt, what did the Israelites have bound up in their clothes upon their shoulders?"," Their kneadingtroughs, Exodus 12:34",12
Bonus for 15: What did the children of Israel borrow from the Egyptians as they left Egypt?," Jewels of silver, jewels of gold, and raiment Exodus 12:35",12
"FIB, one blank referring to the Israelites as they left Egypt, And they _____ the Egyptians"," spoiled, Exodus 12:36",12
How many Israelite men did Exodus chapter 12 say left Egypt?," six hundred thousand, Exodus 12:37",12
"In Exodus 12, the Israelites journeyed from what place to Succoth?"," Rameses, Exodus 12:37",12
The Israelites journeyed from Rameses to what place?," Succoth, Exodus 12:37",12
"Bonus for 15: FIB: And a mixed multitude went up also with them, and ___, and ___, even very much ___","flocks, herds, cattle, Exodus 12:38",12
What did the Israelites bake with the dough they brought out of Egypt?,"unleavened cakes, Exodus 12:39",12
"Because they were thrust out of Egypt, the Israelites could not tarry, neither had they prepared for themselves what?","(any) victual, Exodus 12:39",12
How long did the children of Israel sojourn in Egypt?," Four hundred and thirty years, Exodus 12:40",12
FIB with one blank: This is that night of the Lord to be ___ of all the children of Israel in their generations.,"observed, Exodus 12:42",12
FIB with one blank: This is that night of the Lord to be observed of all the children of Israel in their ___.,"generations, Exodus 12:42",12
What were the Israelites forbidden to break on the passover lamb?," A bone, Exodus 12:46",12
By what did the Lord bring the children of Israel out of the land of Egypt?,"their armies, Exodus 12:51",12
What did God command Moses for the Israelites to sanctify to Him in Exodus 13?," ""All the firstborn,"" (Exodus 13:2)",13
God commanded that the Israelites sanctify to him all the firstborn of man and of what?, beast Exodus 13:2,13
"Finish the verse: Whatsoever openeth the womb among the children of Israel, both of man and of beast...","it is mine, Exodus 13:2",13
"God said it is mine, referring to whatsoever openeth what among the children of Israel?","the womb, Exodus 13:2",13
Moses referred to Egypt as the house of what?,"bondage, Exodus 13:3",13
What did God command should not be eaten during the Feast of Unleavened Bread?," ""Leavened bread."" (Exodus 13:3)",13
Name the month on which Moses said that the children of Israel came out of Egypt., Abib (Exodus 13:4),13
On which day of the Feast of Unleavened Bread was there to be a feast to the Lord?," ""The seventh day."" (Exodus 13:6)",13
"FIB with one blank: Seven days thou shalt eat unleavened bread, and in the seventh day shall be a ___ to the Lord.","feast, Exodus 13:6",13
Neither shall this thing be seen with thee in all thy quarters. What is this referring to?,"leaven, Exodus 13:7",13
"Who were the Israelites to show saying the following, ""This is done because of that which the Lord did unto me when I came forth out of Egypt?", their son Ex 13:8,13
"Bonus for 15: And it shall be for a sign unto thee upon thine hand, and for a ___ between thine ___, that the Lord's law may be in thy ___.","memorial, eyes, mouth, Exodus 13:9",13
Moses said the feast of unleavened bread would be a memorial between what of the Israelites?,"their eyes, Exodus 13:9",13
"According to Moses, the Lord's law should be in what of the Isarelites?","their mouths, Exodus 13:9",13
FIB with one blank from Exodus 13: Thou shalt therefore keep this ___ in his season from year to year.,"ordinance, Exodus 13:10",13
What land did Moses say the Lord sware unto the Israelites and their fathers?,"the land of the Canaanites (Canaan), Exodus 13:11",13
"Along with every firstling that cometh of a beast, Moses said that the Isarelites should set apart all that openeth what for the Lord?","the matrix, Exodus 13:12",13
What was to happen to the firstborn male of an ass if it was not redeemed?," ""Thou shalt break his neck."" (Exodus 13:13)",13
What did Moses say shall done for every firstborn of man?, They had to be redeemed  (Exodus 13:13),13
Moses said that the Israelites shalt do what for every firstling of an ass?," ""Redeem it with a lamb."" (Exodus 13:13)",13
With what animal did Moses say the firstling of an ass shalt be redeemed?,"a lamb, Exodus 13:13",13
"FIB with one blank: I sacrifice to the Lord all that openeth the matrix, being ___.","males, Exodus 13:15",13
"Bonus for 15: And it shall be for a token upon thine ___, and for frontlets between thine ___, for by strength of ___ the Lord brought us forth out of Egypt.","hand, eyes, hand, Exodus 13:16",13
God did not let the Israelites go through the land of the Philistines because God thought they might repend when the see war and do what?,"return to Egypt, Exodus 13:17",13
God said that if the Israelites went through the land of the Philistines they might repent when they saw what?,"war, Exodus 13:17",13
"When Pharaoh let them go, God led the Israelites through the wilderness of what?","the Red sea, Exodus 13:18",13
Whose bones did the children of Israel take with them when they left Egypt?, Joseph's Exodus 13:19,13
Who straightly swore to the children of Israel saying God will surely visit you and ye shall carry up my bones away hence with you?, Joseph Exodus 13:19,13
"The Isarelites travelled from Succoth and encamped in what place, in the edge of the wilderness?","Etham, Exodus 13:20",13
The Isrealites took their journey from this place and encamped in Etham. Name the place.,"Succoth, Exodus 13:20",13
What did God use to guide the Israelites by day?," ""A pillar of a cloud."" (Exodus 13:21)",13
What did God use to guide the Israelites by night?," ""A pillar of fire."" (Exodus 13:21)",13
Pi-hahiroth was located between Migdol and the sea over against this place. What was the name of this place?, Baal zephon Ex 14:2,14
Bonus for 10: What were the two places that Exodus 14 locates Pi hahiroth between?, Between Migdol and the sea Exodus 14:2,14
"FIB one blank, ""For Pharaoh will say of the children of Israel, They are _____ in the land, the wilderness hath shut them in.""", entangled  Ex 14:3,14
Why did the LORD say Pharaoh would think the Israelites were entangled in the land?, Because the wilderness hath shut them in Exodus 14:3,14
"What did God say He would harden, so that Pharaoh would follow after the Israelites?", Pharaoh’s heart Exodus 14:4,14
"Pharaoh and his servants asked, why they let Israel go from doing what?","serving them, Exodus 14:5",14
How many chosen chariots did Pharaoh take with him?, Six hundred Exodus 14:7,14
Bonus for 15: Pharaoh made ready his chariot and took people with him. Describe what else he brought with him?," Six hundred chosen chariots, all the chariots of Egypt, captains over every one of them Exodus 14:7",14
"According to Exodus chapter 14, what did each of Pharoah's chariots have over them?",Captains Exodus 14:7,14
"The Egyptians overtook the Israelites, encamping where, beside Pi-hahiroth, before Baal-zephon","by the sea, Exodus 14:9",14
"The Egyptians overtook the Israelites, encamping by the sea, beside this place, before Ball-zephon. Name the place.","Pi-hahiroth, Exodus 14:9",14
"The Egyptians overtook the Israelites, encamping by the sea, beside Pi-hahiroth, before this place. Name the place.","Baal-zephon, Exodus 14:9",14
"Be specific, encamping by the sea, where did Pharoah's army overtake the children of Israel?"," beside Pihahiroth, before Baalzephon Ex 14:9",14
How did the children of Israel feel when they saw the Egyptians marching after them?," They were sore afraid, Exodus 14:10",14
What did the Israelites do when they saw the Egyptians marching after them and were sore afraid?,"they cried out unto the Lord, Exodus 14:10",14
"FIB with one blank: Because there were no ___ in Egypt, hast thou taken us away to die in the wilderness?","graves, Exodus 14:11",14
"Bonus for 15: FIB: And they said unto Moses, Because there were no ___ in Egypt, hast thou taken us away to ___ in the ___?","graves, die, wilderness, Exodus 14:11",14
"When the Israelites saw the Egyptians, what did they accuse Moses of doing because there were no graves in Egypt?", Bringing them to die in the wilderness Exodus 14:11,14
What did the Israelites say it would have been better for them to do than die in the wilderness?, Serve the Egyptians Exodus 14:12,14
"In Exodus 14, who did Moses say the Israelites shall see again no more forever?","the Egyptians (whom ye have seen today), Exodus 14:13",14
"FIB with one blank: And the Lord shall ___ for you, and ye shall hold your peace.","fight, Exodus 14:14",14
"FIB with one blank: And the Lord shall fight for you, and ye shall hold your ___.","peace, Exodus 14:14",14
What did God instruct Moses do in order to divide the sea?," Lift up thy rod, stretch out thine hand over the sea Exodus 14:16",14
God said that the Children of Isarel shall go on what through the midst of the sea?,"dry ground, Exodus 14:16",14
"Be specific, God told Moses that the children of Israel shall go on dry ground through what?","the midst of the sea, Exodus 14:16",14
"FIB with one blank spoken by the Lord: And I will get me ___ upon Pharaoh, and upon all his host, upon his chariots, and upon his horesmen.","honour, Exodus 14:17",14
The pillar of cloud went behind the Isarelites when what removed and went behind them?,"the angel of God, Exodus 14:19",14
The angel of God and the pillar of cloud went from before the Israelites to where?,"behind them, Exodus 14:19",14
"When the angel of God removed and went behind the camp of Israel, what stood behind them?","the pillar of the cloud, Exodus 14:19",14
"When the pillar of cloud moved from before the children of Israel to go behind them, which two camps did it separate?", Camp of the Egyptians and camp of Israelites Ex 14:20,14
The pillar of cloud came between the Isarelites and Egyptians so that one came not near the other over what period of time?,"all the night, Exodus 14:20",14
How did God cause the sea to go back?, By a strong east wind all that night Exodus 14:21,14
How long did the east wind blow that made the sea dry land?, All that night Exodus 14:21,14
The strong east wind made the sea what?,"dry land, Exodus 14:21",14
"Bonus for 20: FIB: And the Lord caused the sea to go back by a ___ ___ ___ all that night, and made the sea dry land, and the waters were ___","strong, east, wind, divided, Exodus 14:21",14
"As the children of Israel crossed the Red Sea, how did it describe the waters on their right hand and their left?", A wall Ex 14:22,14
What did the waters form on either side of the Israelites as  they crossed the Red Sea?, A wall Exodus 14:22,14
During which watch did the LORD look down upon the Egyptian army as they pursued Israel?," The morning watch, Exodus 14:24",14
"In the morning watch, God looked upon the host of the Egyptians through the pillar of fire and cloud and did what to them?","troubled them, Exodus 14:24",14
The Lord took off the Egyptians chariot wheels. How did it say they drave?,"heavliy, Exodus 14:25",14
"In Exodus 14:27, What happened to the sea when Moses stretched forth his hand over it?", The sea returned to his strength Exodus 14:27,14
At what time of day did the sea return to his strength?,"morning, Exodus 14:27",14
What did the Egyptians do when the sea returned its strength?,"fled against it, Exodus 14:27",14
"Bonus for 15: When the water returned, what did it cover?","the chariots, the horsemen, and all the host of Pharaoh, Exodus 14:28",14
"When the waters returned, what did it do to the chariots and horsemen?","covered them, Exodus 14:28",14
Israel saw the Egyptians in what state upon the sea shore?,"dead, Exodus 14:30",14
The Israelites saw the Egyptians dead upon what?,"the sea shore, Exodus 14:30",14
"FIB with one blank: the people feared the Lord, and believed the Lord, and his ___ Moses","servant, Exodus 14:31",14
"FIB, two blanks, I will sing unto the Lord, for he hath triumphed gloriously: the _____ and his _____ hath he thrown into the sea"," horse, rider Ex 15:1",15
What did Miriam have in her hand as she sang to God after crossing the Red  Sea?, a timbrel Ex 15:20,15
Who led the women in singing and dancing?," Miriam (the prophetess, sister of Aaron Exodus) 15:20",15
What instrument did Miriam and the women play as they sang?, Timbrels Exodus 15:20,15
Where did Moses lead Israel after they crossed the Red Sea?, Into the wilderness of Shur Exodus 15:22,15
Moses brought Isarel from what place and went into the wilderness of Shur?,"the Red sea, Exodus 15:22",15
For how many days did the Israelites find no water in the wilderness of Shur?, Three days Exodus 15:22,15
"In the wilderness, the Israelites went three days without finding what?","water, Exodus 15:22",15
What was the name of the place where they found bitter water?, Marah Exodus 15:23,15
Why couldn’t the Israelites drink the water at Marah?, Because it was bitter Exodus 15:23,15
What did the people do when they found the water at Marah was bitter?, They murmured against Moses Exodus 15:24,15
"At Mara, what did Moses do in response to the people's complaints about water?"," He cried unto the Lord, Exodus 15:25",15
What did the Lord show Moses to make the bitter water sweet?," A tree, Exodus 15:25",15
What happened when Moses cast the tree into the waters?," The waters were made sweet, Exodus 15:25",15
What did Moses do with the tree to make the waters sweet?,"cast it into the waters, Exodus 15:25",15
"In one word, how did God say the Israelites must hearken to the voice of the Lord in Marah?","diligently, Exodus 15:26",15
God promised he would put none of the diseases he had put on the Egyptians on the Israelites because he is the Lord that does what?,"healeth thee, Exodus 15:26",15
Where did the Israelites camp after leaving Marah?, Elim Exodus 15:27,15
How many palm trees were at Elim?," Threescorere and ten, Exodus 15:27",15
What place is described as having twelve wells of water and threescore and ten palm trees?,"Elim, Exodus 15:27",15
What did Elim have twelve of?,"wells of water, Exodus 15:27",15
Exodus 15 says the Israelites encamped in Elim by what?,"the waters, Exodus 15:27",15
Where did the children of Israel journey to after Elim?, The wilderness of Sin (Exodus 16:1),16
The congregation of the children of Israel took their journey from this place to the wilderness of Sin. Name the place.,"Elim, Exodus 16:1",16
Bonus for 10: The wilderness of Sin is between what two places?,"Elim and Sinai, Exodus 16:1",16
The wilderness of Sin is between Elim and which place?,"Sinai, Exodus 16:1",16
The Israelites came unto the wilderness of Sin on the fifteenth day of what month after they left Egypt?,"the second month, Exodus 16:1",16
FIB with one blank: The whole congregation of the children of Israel ___ against Moses and Aaron in the wilderness.,"murmured, Exodus 16:2",16
Against what two people did the whole congregation of teh Israelites murmer in the wilderness of Sin?,"Moses and Aaron, Exodus 16:2",16
With what did the children of Isarel say Moses brought them to the wilderness of Sin to kill them with?,"hunger, Exodus 16:3",16
"FIB from Exodus 16: For ye have brought us forth into this wilderness, to kill the whole assembly with ___.","hunger, Exodus 16:3",16
"The Lord said he would rain bread from heaven, what did he say the people should do at a certain rate every day?","gather, Exodus 16:4",16
What did the Lord tell Moses He would rain down from heaven for the Israelites?, Bread (Exodus 16:4),16
From where did God say he would rain bread?,"heaven, Exodus 16:4",16
The Lord wanted the Israelites to gather bread at a certain rate every day to prove whether they will do what?,"walk in (follow) my law, Exodus 16:4",16
At what time of day did Moses say the Lord gave the Israelites bread to the full?,"in the morning, Exodus 16:8",16
Who did Moses and Aaron say the people’s murmurings were against?, The Lord (Exodus 16:8),16
"Who was Aaron to say the following to: ""Come near before the Lord, for he hath heard your murmerings""","all the congregation of the children of Israel, Exodus 16:9",16
"As Aaron spake to the congregation of  the Israelites, in what did the glory of the Lord appear?","a cloud, Exodus 16:10",16
"At even, what came up and covered the camp of the Israelites?", Quails (Exodus 16:13),16
"In the morning, what lay round about the host of the Israelite camp?","dew, Exodus 16:13",16
"Manna, a small round thing, was described as being as small as what?","the hoar frost on the ground, Exodus 16:14",16
"FIB with one word: It is ___, for they wist not what it was.","manna, Exodus 16:15",16
How much manna did Moses say to gather for every man according to the numbe of persons?,"an omer, Exodus 16:16",16
Moses told every man to take manna for who?,"them which are in his tents, Exodus 16:16",16
"When they did mete the manna with an omer, what did he that gathered little not have?","lack, Exodus 16:18",16
"Be specific, when they did mete the manna with an omer, who had nothing over?","he that gathered much, Exodus 16:18",16
What were the Israelites instructed not to leave the manna until what time?,"the morning, Exodus 16:19",16
What happened to the manna of those that left it until the morning?, It bred worms and stank (Exodus 16:20),16
How did Moses feel toward those that left manna until the morning?,"he was wroth with them, Exodus 16:20",16
What happened to the manna when the sun waxed hot?,"it melted, Exodus 16:21",16
On which day did the manna not spoil when kept until morning?," On the sixth day, (Exodus 16:24)",16
"On the Sabbath, where did Moses say the Israelites would not find manna?","in the field, Exodus 16:25",16
"When the people went to gether manna on the seventh day, the Lord asked Moses how long they would refuse to keep what two things?","His commandments and laws, Exodus 16:28",16
FIB with one blank: So the people ___ on the seventh day.,"rested, Exodus 16:30",16
How was the taste of manna described?, Like wafers made with honey (Exodus 16:31),16
What name did the Israelites give to the bread from heaven?, Manna (Exodus 16:31),16
Bonus for 20: Describe manna as it was described in Exodus 16:31,"it was like coriander seed, white, and the taste of it was like wafers made with honey, Exodus 16:31",16
Who carried out God’s command to preserve an omer of manna as a testimony?, Aaron (Exodus 16:33-34),16
"Who said the following and to whom: ""take a pot, and put an omer full of manna therin, and lay it up before the Lord, to be kept for your generations""","Moses to Aaron, Exodus 16:33",16
"Be specific, Moses told Aaron to take a pot and put what in it to be kept for generations?","an omer (full) of manna, Exodus 16:33",16
Aaron was told to take a pot of manna and lay it before the Lord to be kept for what?,"his generations, Exodus 16:33",16
For how many years did the Israelites eat manna?,"forty, Exodus 16:35",16
What is the tenth part of an ephah?,"an omer, Exodus 16:36",16
"According to Exodus, how is an omer related to an ephah?","an omer is the tenth part of an ephah, Exodus 16:36",16
An omer is the tenth part of what?,"an ephah, Exodus 16:36",16
The Israelites traveled from the wilderness of Sin to this place where there was no water to drink. Name the place.," Rephidim,  Exodus 17:1",17
What was there none of when the Israelites pitched in Rephidim?,"water, Exodus 17:1",17
The Israelites pitched in Rephidim according to what?,"the commandment of the Lord, Exodus 17:1",17
"According to the commandment of the Lord, the children of Israel did what in Rephidim?","pitched, Exodus 17:1",17
The people did what with Moses as they asked him to give them water to drink?,"chided with Moses, Exodus 17:2",17
FIB with one blank from Moses in Rephidim: Why ___ ye with me? wherefore do ye tempt the Lord?,"chide, Exodus 17:2",17
What did the people do against Moses in Rephidim?,"murmured, Exodus 17:3",17
"In Rephidim, the people asked Moses if he brought them out of Egypt to kill them with what?","thirst, Exodus 17:3",17
What did Moses do after the Israelites said that he brought them out of Egypt to die of thirst?," He cried out to the Lord,  Exodus 17:4",17
"When there was no water in Rephidim, Moses asked the Lord what to do because the people were ready to do what to him?","stone him, Exodus 17:4",17
"Who said these words: ""What shall I do unto this people? they be almost ready to stone me.""","Moses, Exodus 17:4",17
FIB with one blank: What shall I do unto this people? they be almost ready to ___ me.,"stone, Exodus 17:4",17
"God told Moses in Rephidim to take what, which he used to smite the river?","his rod, Exodus 17:5",17
"In Rephidim, God said that he would stand before Moses upon the rock in what place?","Horeb, Exodus 17:6",17
What would happened when Moses struck the rock in Horeb?,"water would come out of it,  Exodus 17:6",17
What two names did Moses give the place where he struck the rock?," Massah and Meribah,  Exodus 17:7",17
"In Massah and Meribah, the Israelites temped the Lord asking what?"," ""Is the Lord among us, or not?"",  Exodus 17:7",17
Who came to fight with Israel at Rephidim?," Amalek,  Exodus 17:8",17
Who did Moses tell to choose men and go fight against Amalek?," Joshua,  Exodus 17:9",17
Who was the leader of the Israelite army in the battle against Amalek?," Joshua,  Exodus 17:10",17
What happened when Moses held up his hand during the battle?," Israel prevailed,  Exodus 17:11",17
What happened when Moses let down his hand?," Amalek prevailed,  Exodus 17:11",17
Amalek prevailed when what happened in Exodus 17?,"When Moses let down his hand, Exodus 17:11",17
"FIB with one blank: But Moses hands were ___, and they took a stone and put it under him, and he sat thereon.","heavy, Exodus 17:12",17
What did Aaron and Hur put under Moses when his hands were heavy?,"a stone, Exodus 17:12",17
With what did Joshua discomfit Amalek and his people?,"the edge of his sword, Exodus 17:13",17
"Be specific, what did Joshua do to Amalek and his people with the edge of his sword?","discomfited them, Exodus 17:13",17
