Question,Answer,Chapter
"Bonus for 10: FIB: If the ___ be too strong for me, then thou shalt help me, but if the children of ___ be to strong for thee, then I will come and help thee.","Syrians, Ammon, 2 Samuel 10:11",10
"FIB with one blank: Be of good ___, and let us play the men for our people and for the cities of our God.","courage, 2 Samuel 10:12",10
"FIB with one blank: Be of good courage, and let us play the men for our people and for the ___ of our God.","cities, 2 Samuel 10:12",10
Who fled before Joab in 2 Samuel 10?,"the Syrians, 2 Samuel 10:13",10
Who fled before Abishai after seeing that the Syrians fled?,"the children of Ammon, 2 Samuel 10:14",10
"The children of Ammon fled before Abishai and did what, causing Joab to return to Jerusalem?","entered into the city, 2 Samuel 10:14",10
Who returned from the children of Ammon and came to Jerusalem after the children of Ammon fled into their city?,"Joab, 2 Samuel 10:14",10
"FIB with one blank: And when the Syrians saw they were ___ before Israel, they gathered themselves together.","smitten, 2 Samuel 10:15",10
Who was the captain of the host of Hadarezer?,"Shobach, 2 Samuel 10:16",10
Hadarezer brought out the Syrians that were beyond the river. What place did they come to?,"Helam, 2 Samuel 10:16",10
"FIB with one blank: And ___ sent, and brought out the Syrians that were beyond the river, and they came to Helam.","Hadarezer, 2 Samuel 10:16",10
"FIB with one blank: And the Syrians set themselves in ___ against David, and fought with him.","array, 2 Samuel 10:17",10
"FIB with one blank: And when it was told David, he gathered all Israel together, and passed over ___, and came to Helam.","Jordan, 2 Samuel 10:17",10
"In Helam, what group set themselves in array against David?","the Syrians, 2 Samuel 10:17",10
What captain of the Syrian host did David smite at Helam?,"Shobach, 2 Samuel 10:18",10
David slew the men of how many chariots of the Syrians at Helam?,"seven hundred, 2 Samuel 10:18",10
How many Syrian horsemen did David slay in 2 Samuel 10?,"forty thousand, 2 Samuel 10:18",10
Shobach died fighting against David. What role did he have for the Syrians?,"captain of the host, 2 Samuel 10:18",10
"Bonus for 20: And when all the ___ that were servants to Hadarezer saw that they were ___ before Israel, they made ___ with Israel, and ___ them.","kings, smitten, peace, served, 2 Samuel 10:19",10
"In 2 Samuel 10:19, who feared to help the children of Ammon anymore?","the Syrians, 2 Samuel 10:19",10
"FIB with one blank: And when all the kings that were servants to ___ saw that they were smitten before Israel, they made peace with Israel, and served them.","Hadarezer, 2 Samuel 10:19",10
David sent Joab to destroy these people and besiege Rabbah. Who were these people?,"the children of Ammon, 2 Samuel 11:1",11
"In 2 Samuel 11:1, David sent Joab and besieged what place as David tarried in Jerusalem?","Rabbah, 2 Samuel 11:1",11
Where did David still tarry as Joab besieged Rabbah and destroyed the children of Ammon?,"Jerusalem, 2 Samuel 11:1",11
"At what time of day did David arise from his bed, walk upon the roof and see a woman washing herself?","eventide, 2 Samuel 11:2",11
David arose from off his bed and did what before he saw a woman washing herself?,"walked upon the roof of the king's house, 2 Samuel 11:2",11
How was the woman David saw bathing from the roof described to look upon?,"very beautiful, 2 Samuel 11:2",11
What was the woman David saw from the roof doing?,"bathing herself, 2 Samuel 11:2",11
"FIB with one blank: And David sent and ___ after the woman. And one said, Is not this Bathsheba...","enquired, 2 Samuel 11:3",11
Bonus for 20: David sent and enquired after the woman he saw bathing. What name and relations were told to him?,"Bathsheba, the daughter of Eliam, the wife of Uriah the Hittite, 2 Samuel 11:3",11
"FIB with one blank: Is this not ___, the daughter of Eliam, the wife of Uriah the Hittite.","Bathsheba, 2 Samuel 11:3",11
What was the name of Bathsheba's husband?,"Uriah, 2 Samuel 11:3",11
"Bonus for 15: FIB: And David sent ___, and took her, and she came in unto him, and he ___ with her, for she was ___ from her uncleanness.","messengers, lay, purified, 2 Samuel 11:4",11
"When David lay with Bathsheba, she was described as being purified from what?","her uncleanness, 2 Samuel 11:4",11
"After David lay with Bathsheba the first time, what did she do?","returned unto her house, 2 Samuel 11:4",11
"Bonus for 15: FIB: And the woman ___, and sent and told ___, and said, I am with ___.","conceived, David, child, 2 Samuel 11:5",11
What did Bathsheba tell David after she conceived?,"I am with child, 2 Samuel 11:5",11
"After hearing that Bathsheba was with child, who ask to be sent to him?","Uriah [the Hittite], 2 Samuel 11:6",11
Who sent Uriah to David?,"Joab, 2 Samuel 11:6",11
"When Uriah was come unto him, David demanded of him how this person did. Name the person.","Joab, 2 Samuel 11:7",11
David demanded of Uriah how what prospered?,"the war, 2 Samuel 11:7",11
"In 2 Samuel, who did David speak the following to: ""Go down to thy house, and wash thy feet.""","Uriah, 2 Samuel 11:8",11
"David told Uriah to go where, and wash his feet?","thy house, 2 Samuel 11:8",11
Uriah departed out of the king's house and what followed him from the king?,"a mess of meat, 2 Samuel 11:8",11
"Be specific, where did Uriah sleep after being told to go to his house and wash his feet?","the door of the king's house, 2 Samuel 11:9",11
What did Uriah do at the door of the king's house with all the servants of his lord?,"slept, 2 Samuel 11:9",11
"Bonus for 15: FIB: But ___ ___ at the door of the king's house with all the servants of his lord, and went not down to his ___.","Uriah, slept, house, 2 Samuel 11:9",11
"When the told David Uriah did not go down unto his house, David asked him Camest thou not from what?","thy journey, 2 Samuel 11:10",11
"Bonus for 10: Who said the following to whom: ""Camest thou not from thy journey? why then didst thou not go down unto thine house?""","David to Uriah, 2 Samuel 11:10",11
"Uriah told David that Israel, Judah, and what object abide in tents?","the ark, 2 Samuel 11:11",11
"According to Uriah, what did Israel and Judah abide in?","tents, 2 Samuel 11:11",11
"Bonus for 15: And my lord ___, and the servants of my lord, are ___ in open ___.","Joab, encamped, fields, 2 Samuel 11:11",11
Uriah asked if he should go into his house to eat drink and do what?,"lie with my wife, 2 Samuel 11:11",11
"Uriah asked if he should go to what place to eat, drink, and lie with his wife?","mine house, 2 Samuel 11:11",11
"FIB with one blank from Uriah to David: As thou livest, and as thy ___ liveth, I will not do this thing.","soul, 2 Samuel 11:11",11
"FIB with one blank: And David said unto Uriah, ___ here to day also, and to morrow I will let thee depart.","Tarry, 2 Samuel 11:12",11
"FIB with one blank: And David said unto Uriah, Tarry here to day also, and to morrow I will let thee ___.","depart, 2 Samuel 11:12",11
"FIB with one blank: So Uriah abode in ___ that day, and the morrow.","Jerusalem, 2 Samuel 11:12",11
"FIB with one blank: And when David had called him, he did eat and drink before him, and he made him ___.","drunk, 2 Samuel 11:13",11
"When he was made drunk, Uriah went out to lie on his bed with what people?","the servants of his lord, 2 Samuel 11:13",11
"Uriah did eat and drink before him, and David made him drunk. Where did he not go down to?","his house, 2 Samuel 11:13",11
"Bonus for 15: FIB from 2 Samuel 11: And it came to pass in the morning, that ___ wrote a letter to ___, and sent it by the hand of ___.","David, Joab, Uriah, 2 Samuel 11:14",11
David sent a letter by the hand of Uriah. Who was it written to?,"Joab, 2 Samuel 11:14",11
"Be specific, David wrote, telling Joab to set Uriah in the forefront of what?","the hottest battle, 2 Samuel 11:15",11
FIB with one blank: Set ye Uriah in the ___ of the hottest battle...,"forefront, 2 Samuel 11:15",11
David told Joab to set Uriah in the forefront of the hottest battle and do what so that he may be smitten and die?,"retire ye from him, 2 Samuel 11:15",11
Joab was told to retire from Uriah so that what may happen to him?,"he may be smitten and die, 2 Samuel 11:15",11
"When Joab observed the city, to what kind of place did he assign Uriah?","a place where he knew that valiant men were, 2 Samuel 11:16",11
Who observed the city and assigned a specific place to Uriah?,"Joab, 2 Samuel 11:16",11
What kind of men did Joab know were in the place he assigned to Uriah?,"valiant, 2 Samuel 11:16",11
"Bonus for 20: In 2 Samuel 11, the men of the city went out and fought with Joab. What happened in that fighting?","there fell some of the people of the servants of David, and Uriah the Hittite died also, 2 Samuel 11:17",11
"After Uriah died, who told David all things concerning the war?","Joab, 2 Samuel 11:18",11
"Joab charged who, saying ""When thou hast made and ending of telling the matters unto the king...""","the messenger, 2 Samuel 11:19",11
"FIB with one blank: And if so be that the king's ___ arise, and he say unto thee, Wherefore approached ye so nigh unto the city when ye did fight?","wrath, 2 Samuel 11:20",11
Bonus for 15: FIB: Wherefore approached ye so ___ unto the city when ye did fight? knew ye not that they would ___ over the ___?,"nigh, shoot, wall, 2 Samuel 11:20",11
Bonus for 15: FIB: Wherefore ___ ye so nigh unto the ___ when ye did ___? knew ye not that they would shoot over the wall?,"approached, city, fight, 2 Samuel 11:20",11
"The messenger was charged that David may ask who smote this person, the son of Jerubbesheth. Name this person.","Abimelech, 2 Samuel 11:21",11
Who was Abimelech father according to 2 Samuel 11?,"Jerubbesheth, 2 Samuel 11:21",11
The messenger was charged that the king may asked who smote Abimelech. He might also ask if a woman cast what from the wall?,"a piece of millstone, 2 Samuel 11:21",11
Where did Abimelech die after a woman cast a piece of millstone?,"Thebez, 2 Samuel 11:21",11
"Bonus for 20: FIB: Why went ye ___ the ___? then say thou, Thy servant ___ the ___ is dead also.","nigh, wall, Uriah, Hittite, 2 Samuel 11:21",11
"FIB with one blank: So the ___ went, and came and shewed David all that Joab had sent him for.","messenger, 2 Samuel 11:22",11
"FIB with one blank: Surely the men ___ against us, and came out unto us into the field, and we were upon them even unto the entering of the gate.","prevailed, 2 Samuel 11:23",11
"FIB with one blank: Surely the men prevailed against us, and came out unto us into the field, and we were upon them even unto the ___ of the gate.","entering, 2 Samuel 11:23",11
"FIB with one blank: Surely the men prevailed against us, and came out unto us into the field, and we were upon them even unto the entering of the ___.","gate, 2 Samuel 11:23",11
"FIB with one blank: And the ___ shot from off the wall upon thy servants, and some of the king's servants be dead...","shooters, 2 Samuel 11:24",11
"In 2 Samuel 11, the messenger told David that some of the king's servants be dead. Who did he specifically mention.","Uriah the Hittite, 2 Samuel 11:24",11
David spoke to Joab through the messenger. He told him to not let this thing displease him because the sword does what?,"devoureth one as well as another, 2 Samuel 11:25",11
What did David say devoureth one as well as another?,"the sword, 2 Samuel 11:25",11
"FIB with one blank from David to the messenger: Thus shalt thou say unto Joab, Let not this thing ___ thee...","displease, 2 Samuel 11:25",11
David spoke to Joab through the messenger. He told him to make what more strong against the city?,"thy battle, 2 Samuel 11:25",11
"FIB with one blank: Make thy battle more strong against the city, and ___ it, and encourage thou him.","overthrow, 2 Samuel 11:25",11
"FIB with one blank: Make thy battle more ___ against the city, and overthrow it, and encourage thou him.","strong, 2 Samuel 11:25",11
What did the wife of Uriah do when she heard that Uriah was dead?,"mourned for her husband, 2 Samuel 11:26",11
"FIB with the same word: When the wife of ___ heard that ___ her husband was dead, she mourned for her husband.","Uriah, 2 Samuel 11:26",11
"When the mourning was passed, what did David first do regarding the wife of Uriah?","fetched her, 2 Samuel 11:27",11
What did the wife of Uriah become when the mourning was past?,"David's wife, 2 Samuel 11:27",11
"The wife of Uriah was fetched by David, became his wife, and did what?","bare him a son, 2 Samuel 11:27",11
Bathsheba became David's wife and bare him a son. What was the Lord's reaction?,"displeased, 2 Samuel 11:27",11
FIB with one blank from 2 Samuel 11: But the thing that David had done ___ the Lord.,"displeased, 2 Samuel 11:27",11
Who sent Nathan unto David?,"the Lord, 2 Samuel 12:1",12
"Who said the following: ""There were two men in one city, the one rich, and the other poor.""","Nathan, 2 Samuel 12:1",12
Nathan said to David that there were two men in one city. How were they described?,"the one rich, and the other poor, 2 Samuel 12:1",12
Nathan described the rich man as having exceeding many flocks and what?,"herds, 2 Samuel 12:2",12
Who did Nathan describe as having exceeding many flocks and herds?,"the rich man, 2 Samuel 12:2",12
"The poor man had nothing, save what, according to Nathan?","one little ewe lamb, 2 Samuel 12:3",12
"Bonus for 15: FIB: But the ___ man had nothing, save one little ___ lamb, which he had brought and ___ up.","poor, ewe, nourished, 2 Samuel 12:3",12
The little ewe lamb grew up with the poor man and with who?,"his children, 2 Samuel 12:3",12
"What of the poor man did the lamb eat, according to Nathan?","his own meat, 2 Samuel 12:3",12
"The little ewe lamb drank of what, in relation to the poor man?","his own cup, 2 Samuel 12:3",12
"According the Nathan, where did the poor man's lamb lay?","in his bosom, 2 Samuel 12:3",12
The one little ewe lamb was unto the poor man as what?,"a daughter, 2 Samuel 12:3",12
"In Nathan's parable, who came unto the rich man?","a traveller, 2 Samuel 12:4",12
"When a traveller came unto the rich man, the rich man spared to take of what for the traveller?","his own flock [and of his own herd], 2 Samuel 12:4",12
"FIB with one blank: And he spared to take of his own flock and of his own herd, to dress for the ___ man that was come unto him...","wayfaring, 2 Samuel 12:4",12
"According to Nathan, what did the rich man do when a traveller came unto him?",took the poor man's lamb,12
"FIB about the rich man: but took the poor man's lamb, and ___ it for the man that was come to him.","dressed, 2 Samuel 12:4",12
How were David's emotions described after hearing about the rich man from Nathan?,"his anger was greatly kindled against the man, 2 Samuel 12:5",12
"Bonus for 15: And David's ___ was greatly ___ against the man, and he said to ___, as the Lord liveth, the man that hath done this thing shall surely die.","anger, kindled, Nathan, 2 Samuel 12:5",12
"David told Nathan that as the Lord liveth, what shall surely happen to the man?","the man that hath done this thing shall surely die, 2 Samuel 12:5",12
"FIB with one blank: As the Lord ___, the man that hath done this thing shall surely die.","liveth, 2 Samuel 12:5",12
How did David say the rich man should restore the lamb?,"fourfold, 2 Samuel 12:6",12
David said that the rich man would restore the lamb fourfold because he did this thing and for what other reason?,"because he had no pity, 2 Samuel 12:6",12
What is the first thing Nathan told David after he declared that the rich man would restore the lamb fourfold?,"Thou art the man, 2 Samuel 12:7",12
Bonus for 10: Who said the following and to whom: Thou art the man.,"Nathan to David, 2 Samuel 12:7",12
"FIB with one blank: Thus saith the Lord God of Israel, I ___ thee king over Israel, and I delivered thee out of the hand of Saul.","anointed, 2 Samuel 12:7",12
"FIB with one blank: Thus saith the Lord God of Israel, I anointed thee king over Israel, and I ___ thee out of the hand of Saul.","delivered, 2 Samuel 12:7",12
"FIB with one blank: Thus saith the Lord God of ___, I anointed thee king over Israel, and I delivered thee out of the hand of Saul.","Israel, 2 Samuel 12:7",12
"FIB with one blank: Thus saith the Lord God of Israel, I anointed thee king over Israel, and I delivered thee out of the hand of ___.","Saul, 2 Samuel 12:7",12
"Along with thy master's wives, what of thy master was David told that the Lord gave him?","thy master's house, 2 Samuel 12:8",12
"FIB with one blank: And I gave thee thy master's house, and thy master's wives into thy bosom, and gave thee the house of Israel and of ___.","Judah, 2 Samuel 12:8",12
"FIB with one blank: And I gave thee thy master's house, and thy master's wives into thy ___, and gave thee the house of Israel and of Judah.","bosom, 2 Samuel 12:8",12
"FIB with one blank: And I gave thee thy master's house, and thy master's wives into thy bosom, and gave thee the ___ of Israel and of Judah.","house, 2 Samuel 12:8",12
"David was asked, wherefore hast thou despised what, of the Lord, to do evil in his sight?","the commandment, 2 Samuel 12:9",12
"Bonus for 20: FIB: Thou hast killed ___ the ___ with the sword, and hast taken his wife to be thy wife, and hast slain him with the sword of the  ___ of ___.","Uriah, Hittite, children, Ammon, 2 Samuel 12:9",12
Nathan told David that he killed Uriah the Hittite with the sword of who?,"the children of Ammon, 2 Samuel 12:9",12
"FIB with one blank: Wherefore hast thou ___ the commandment of the Lord, to do evil in his sight?","despised, 2 Samuel 12:9",12
Nathan told David that he killed Uriah the Hittite. What did he say David did with Uriah's wife?,"took his wife to be thy wife, 2 Samuel 12:9",12
David was told that what would never depart from his house house because he despised the Lord?,"the sword, 2 Samuel 12:10",12
"FIB with one blank: Now therefore the sword shall never depart from thine house, because thou hast ___ me, and hast taken the wife of Uriah the Hittite to be thy wife.","despised, 2 Samuel 12:10",12
"David was told that the sword would never depart from where, because he despised the Lord?","his house, 2 Samuel 12:10",12
The Lord said he would raise up evil against David's house. He said He'd take David's wives from before his eyes and give them unto who?,"thy neighbor, 2 Samuel 12:11",12
The Lord said that David's neighbor would lie with his wives in the sight of what?,"[this] sun, 2 Samuel 12:11",12
What did the Lord say David neighbor would do in the sight of this sun?,"lie with thy wives, 2 Samuel 12:11",12
"FIB with one blank: For thou didst it ___, but I will do this thing before all Israel, and before the sun.","secretly, 2 Samuel 12:12",12
"FIB with one blank: For thou didst it secretly, but I will do this thing before all ___, and before the sun.","Israel, 2 Samuel 12:12",12
"FIB with one blank: For thou didst it secretly, but I will do this thing before all Israel, and before the ___.","sun, 2 Samuel 12:12",12
"Who did David say the following to: ""I have sinned against the Lord""","Nathan, 2 Samuel 12:13",12
Nathan told David that the Lord hast put away thy sin. What did Nathan say David shall not do?,"die, 2 Samuel 12:",12
Nathan told David that he shalt not die. What did he say the Lord hath put away?,"thy sin, 2 Samuel 12:13",12
Nathan told David that by this deed he gave great occasion to the enemies of the Lord to do what?,"blaspheme, 2 Samuel 12:14",12
"FIB with one blank: Howbeit, because by this deed thou hast given great ___ to the enemies of the Lord to blaspheme, the child also that is born unto thee shall surely die.","occasion, 2 Samuel 12:14",12
"Nathan told David, thou shalt not die. Who did he say shall surely die?","the child that is born unto thee, 2 Samuel 12:14",12
"FIB with one blank: And ___ departed utno his house. And the Lord struck the child that Uriah's wife bare unto David, and it was very sick.","Nathan, 2 Samuel 12:15",12
"In 2 Samuel 12, the Lord struck the child that who bare?","Uriah's wife, 2 Samuel 12:15",12
"After the Lord struck the child that Uriah's wife bare, how was the child described?","very sick, 2 Samuel 12:15",12
"FIB with the same word: ___ therefore besought God for the child, and ___ fasted, and went in, and lay all night upon the earth.","David, 2 Samuel 12:16",12
"David fasted and did what all night, as he besought the Lord for the child?","lay [all night] upon the earth, 2 Samuel 12:16",12
Who arose and went to David to raise him up from the earth?,"the elders of his house, 2 Samuel 12:17",12
"When the elders of his house went to raise him up, David would not, neither did he do what with them?","eat bread, 2 Samuel 12:17",12
On what day did Uriah's wife's child die?,"the seventh day, 2 Samuel 12:18",12
Who feared to tell David that his child was dead?,"the servants of David, 2 Samuel 12:18",12
"On the seventh day, what did the servants of David fear to tell him?","the child was dead, 2 Samuel 12:18",12
David's servants said that the child was yet alive they spake unto him and he would not do what?,"hearken unto our voice, 2 Samuel 12:18",12
"FIB spoken by David's servants: how will he then ___ himself, if we tell him that the child is dead?","vex, 2 Samuel 12:18",12
David perceived that the child was dead when he saw what?,"that his servants whispered, 2 Samuel 12:19",12
What did David ask his servants when he saw that they whispered?,"Is the child dead?, 2 Samuel 12:19",12
"When David asked ""Is the child dead?"" what was the servants response?","he is dead, 2 Samuel 12:19",12
"Bonus for 15: After his servants told him that the child was dead, David arose from the earth and did what 3 things, before coming in to the house of the Lord?","washed, anointed himself, changed his apparel, 2 Samuel 12:20",12
"Who arose from the earth, washed and anointed themselves, changed their apparel, and then came into the house of the Lord to worship?","David, 2 Samuel 12:20",12
"After his son died, David came into the house of the Lord and did what?","worshipped, 2 Samuel 12:20",12
"After his son died, what was the very first thing David did?","arose from the earth, 2 Samuel 12:20",12
When did David's servants say he fasted and wept for the child?,"when it was alive, 2 Samuel 12:21",12
"Bonus for 15: FIB: What thing is this that thou hast done? thou didst ___ and ___ for the child, while it was ___...","fast, weep, alive, 2 Samuel 12:21",12
"David servants asked ""What thing is this that thou hast done?"" What did they say David did when the child was dead?","rise and eat bread, 2 Samuel 12:21",12
"Bonus for 20: FIB: While the child was yet alive, I __ and ___, for I said, Who can tell whether God will be ___ to me, that the child may ___.","fasted, wept, gracious, live, 2 Samuel 12:22",12
"David said that while his child was alive his fasted and wept. He asked who can tell whether God will be gracious to me, that what may happen?","the child may live, 2 Samuel 12:22",12
"David said of the child that died, I shall go to him, but what would the child not do?","return to me, 2 Samuel 12:23",12
"FIB with one blank: But now he is ___, wherefore should I fast? can I bring him back again?","dead, 2 Samuel 12:23",12
"FIB with one blank: But now he is dead, wherefore should I ___? can I bring him back again?","fast, 2 Samuel 12:23",12
"After the child died, who did David comfort in 2 Samuel 12?","Bathsheba [his wife], 2 Samuel 12:24",12
"David comforted his wife, and went in unto her, and lay with her. What did Bathsheba do?","bare a son, 2 Samuel 12:24",12
"Bathsheba bare a son, what did David call his name?","Solomon, 2 Samuel 12:24",12
How did the Lord feel about David's son Solomon?,"he loved him, 2 Samuel 12:24",12
"Through Nathan the prophet, what did the Lord call Solomon?","Jedidiah, 2 Samuel 12:25",12
"FIB with one blank: And he sent by the hand of Nathan the prophet, and he called his name ___, because of the Lord.","Jedidiah, 2 Samuel 12:25",12
"After Solomon was born, Joab fought against and took what royal city?","Rabbah, 2 Samuel 12:26",12
Rabbah was described as what kind of city?,"royal, 2 Samuel 12:26",12
Rabbah was the royal city of what people?,"the children of Ammon, 2 Samuel 12:26",12
Joab sent messengers to David and described Rabbah as the city of what?,"waters, 2 Samuel 12:27",12
"FIB with one blank: I have fought against ___, and have taken the city of waters.","Rabbah, 2 Samuel 12:27",12
"Joab told David to gather the rest of the people and encamp against Rabbah and take it, lest Joab take the city and what happens?","it be called after Joab's name, 2 Samuel 12:28",12
"FIB from Joab: Now therefore gather the rest of the people together, and ___ against the city, and take it...","encamp, 2 Samuel 12:28",12
"Who gathered all the people together, went to Rabbah, fought against it, and took it?","David, 2 Samuel 12:29",12
"After taking Rabbah, what did David do to their king?","took their king's crown from off his head, 2 Samuel 12:30",12
"At Rabbah, what was the weight of the king's crown?","a talent of gold, 2 Samuel 12:30",12
"Bonus for 20: And he took their king's ___ from off his head, the weight whereof was a ___ of gold with the ___ ___, and it was set on David's head.","crown, talent, precious, stones, 2 Samuel 12:30",12
FIB about David taking Rabbah: And he brought forth the ___ of the city in great abundance.,"spoil, 2 Samuel 12:30",12
FIB about David taking Rabbah: And he brought forth the spoil of the city in great ___.,"abundance, 2 Samuel 12:30",12
"David brought the people of Rabbah and put them under saws, under harrows of iron, and under what, also of iron?","axes, 2 Samuel 12:31",12
"David made the people of Rabbah pass through what, along with putting them under saws?","the brick-kiln, 2 Samuel 12:31",12
