Question,Answer,Chapter
"Bonus for 10: FIB: If the ___ be too strong for me, then thou shalt help me, but if the children of ___ be to strong for thee, then I will come and help thee.","Syrians, Ammon, 2 Samuel 10:11",10
"FIB with one blank: Be of good ___, and let us play the men for our people and for the cities of our God.","courage, 2 Samuel 10:12",10
"FIB with one blank: Be of good courage, and let us play the men for our people and for the ___ of our God.","cities, 2 Samuel 10:12",10
Who fled before Joab in 2 Samuel 10?,"the Syrians, 2 Samuel 10:13",10
Who fled before Abishai after seeing that the Syrians fled?,"the children of Ammon, 2 Samuel 10:14",10
"The children of Ammon fled before Abishai and did what, causing Joab to return to Jerusalem?","entered into the city, 2 Samuel 10:14",10
Who returned from the children of Ammon and came to Jerusalem after the children of Ammon fled into their city?,"Joab, 2 Samuel 10:14",10
"FIB with one blank: And when the Syrians saw they were ___ before Israel, they gathered themselves together.","smitten, 2 Samuel 10:15",10
Who was the captain of the host of Hadarezer?,"Shobach, 2 Samuel 10:16",10
Hadarezer brought out the Syrians that were beyond the river. What place did they come to?,"Helam, 2 Samuel 10:16",10
"FIB with one blank: And ___ sent, and brought out the Syrians that were beyond the river, and they came to Helam.","Hadarezer, 2 Samuel 10:16",10
"FIB with one blank: And the Syrians set themselves in ___ against David, and fought with him.","array, 2 Samuel 10:17",10
"FIB with one blank: And when it was told David, he gathered all Israel together, and passed over ___, and came to Helam.","Jordan, 2 Samuel 10:17",10
"In Helam, what group set themselves in array against David?","the Syrians, 2 Samuel 10:17",10
What captain of the Syrian host did David smite at Helam?,"Shobach, 2 Samuel 10:18",10
David slew the men of how many chariots of the Syrians at Helam?,"seven hundred, 2 Samuel 10:18",10
How many Syrian horsemen did David slay in 2 Samuel 10?,"forty thousand, 2 Samuel 10:18",10
Shobach died fighting against David. What role did he have for the Syrians?,"captain of the host, 2 Samuel 10:18",10
"Bonus for 20: And when all the ___ that were servants to Hadarezer saw that they were ___ before Israel, they made ___ with Israel, and ___ them.","kings, smitten, peace, served, 2 Samuel 10:19",10
"In 2 Samuel 10:19, who feared to help the children of Ammon anymore?","the Syrians, 2 Samuel 10:19",10
"FIB with one blank: And when all the kings that were servants to ___ saw that they were smitten before Israel, they made peace with Israel, and served them.","Hadarezer, 2 Samuel 10:19",10